,,,,,,,,,,,
,EV EDR SCORE,,,,,,,,,,
,Team Name,University Name,TN,Overall Score,Ntonas,K.Papadimitriou,Michalopoulos ,Toulikas,P.Papadimitriou,Papandreou,Karamanlis
,Poseidon Racing Team,University of West Attica,E05,5.5,5.5,,,,,,
,Democritus Racing Team,Democritus University of Thrace,E88,10,10,,,,,,
,Perseus Racing,University of Western Macedonia,E76,3,3,,,,,,
,Aristotle University Racing Team Electric,Aristotle University of Thessaloniki,E11,6,6,,,,,,
,EVR Tuiasi,Technical University Gheorghe Asachi Iasi,E45,1,1,,,,,,
,Centaurus racing team,University Of Thessaly,E77,1,1,,,,,,